"16","I0035","UNCTAD BioTrade Initiative","O0088/DOU|","1","UNCTAD launched the BioTrade Initiative in 1996 during the third Conference of the Parties of the Convention on Biological Diversity (CBD). The mission of the BioTrade Initiative is to stimulate trade and investment in biological resources to further sustainable development in line with the three objectives of the CBD: 1) the conservation of biological diversity; 2) sustainable use of its components; 3) fair and equitable sharing of the benefits arising from the utilisation of genetic resources.<BR>The BioTrade Initiative has established a number of partnerships with national and regional organisations to set up regional and national programmes that enhance the capability of developing countries to produce value-added products and services derived from biodiversity, for both domestic and international markets. In particular, regional programmes complement ongoing efforts of member countries and concentrate on those efforts that are more cost-effective or efficient to be carried out at regional level than at the national level. At the national level, BioTrade programmes promote trade and investment in products and services derived from native or indigenous biodiversity. Since 2003 the BioTrade Initiative has also hosted the BioTrade Facilitation Programme (BTFP), which focuses on enhancing sustainable bio-resources management, product development, value adding processing and marketing.","Regional programmes:<BR>1. Amazon BioTrade: This programme intends to foster trade and investment in biodiversity-based products and services in the Amazon through regional activities. <BR>2. Andean BioTrade: This programme has mainly promoted regional coordination meetings with the aim of contributing to the sharing of experiences, knowledge and visions among the Andean countries.<BR>National Programmes: <BR>1. The BioTrade Programme of Bolivia was launched in 2003 with the objective of stimulating the production and trade of biodiversity products and services following ecological, social and financial sustainability criteria. To date, the PNBS focuses its efforts on natural ingredients and caimans.<BR>2. The BioTrade National Programme in Colombia was launched in 1999. Today this programme, known as Biocomercio Sostenible, carries out a wide range of activities in order to strengthen specific sectors, such as natural ingredients and exotic flowers.<BR>3. In Costa Rica the formulation of a BioTrade National Programme started in April 2005 and it is still under way. To date, butterflies and ecotourism have been envisaged as important biotrade sectors at national level.<BR>4. The BioTrade National Programme in Peru is known as Biocomercio Peru and was launched in 2001. To date Biocomercio Peru focuses its efforts on: natural ingredients, ornamental fish and Paiche (Arapaima Gigas).<BR>5. The Uganda Biotrade Programme was launched in 2005. To date the Programme focuses its efforts on: natural ingredients for food, cosmetics and pharmaceutics, ecotourism and wildlife.<BR>6. In Vietnam, the BTFP has launched activities focusing on the natural ingredients sector.<BR>BioTrade Facilitation Programme (BTFP): This programme was launched in 2003. Its objective is to facilitate sustainable trade in biodiversity products and services, through innovative collaborative arrangements that enhance sustainable bio-resources management, product development, value-added processing and marketing. By providing assistance on specific issues related to trade and investment, BTFP complements the work developed by the National and Regional BioTrade Programmes. Currently BTFP supports value chains in the following sectors: natural ingredients, ecotourism, wildlife for pet trade, native cocoa, tropical flowers and foliage, crocodile leather and meat, ornamental and edible fish.","019-005-068|019-005-076|019-005-170|019-013-188|019-005-218|019-005-604|002-014-800|019-005-862|142-035-704|019-005-328|","199600","0","Lucas Assunção, Chief UNCTAD Biodiversity and Climate Change Section<BR>E-mail: lucas.assuncao@unctad.org","http://www.biotrade.org/",".  unctad biotrade initiative unctad launched the biotrade initiative in 1996 during the third conference of the parties of the convention on biological diversity cbd the mission of the biotrade initiative is to stimulate trade and investment in biological resources to further sustainable development in line with the three objectives of the cbd 1 the conservation of biological diversity; 2 sustainable use of its components; 3 fair and equitable sharing of the benefits arising from the utilisation of genetic resources the biotrade initiative has established a number of partnerships with national and regional organisations to set up regional and national programmes that enhance the capability of developing countries to produce value added products and services derived from biodiversity for both domestic and international markets in particular regional programmes complement ongoing efforts of member countries and concentrate on those efforts that are more cost effective or efficient to be carried out at regional level than at the national level at the national level biotrade programmes promote trade and investment in products and services derived from native or indigenous biodiversity since 2003 the biotrade initiative has also hosted the biotrade facilitation programme btfp which focuses on enhancing sustainable bio resources management product development value adding processing and marketing regional programmes 1 amazon biotrade this programme intends to foster trade and investment in biodiversity based products and services in the amazon through regional activities 2 andean biotrade this programme has mainly promoted regional coordination meetings with the aim of contributing to the sharing of experiences knowledge and visions among the andean countries national programmes 1 the biotrade programme of bolivia was launched in 2003 with the objective of stimulating the production and trade of biodiversity products and services following ecological social and financial sustainability criteria to date the pnbs focuses its efforts on natural ingredients and caimans 2 the biotrade national programme in colombia was launched in 1999 today this programme known as biocomercio sostenible carries out a wide range of activities in order to strengthen specific sectors such as natural ingredients and exotic flowers 3 in costa rica the formulation of a biotrade national programme started in april 2005 and it is still under way to date butterflies and ecotourism have been envisaged as important biotrade sectors at national level 4 the biotrade national programme in peru is known as biocomercio peru and was launched in 2001 to date biocomercio peru focuses its efforts on natural ingredients ornamental fish and paiche arapaima gigas 5 the uganda biotrade programme was launched in 2005 to date the programme focuses its efforts on natural ingredients for food cosmetics and pharmaceutics ecotourism and wildlife 6 in vietnam the btfp has launched activities focusing on the natural ingredients sector biotrade facilitation programme btfp this programme was launched in 2003 its objective is to facilitate sustainable trade in biodiversity products and services through innovative collaborative arrangements that enhance sustainable bio resources management product development value added processing and marketing by providing assistance on specific issues related to trade and investment btfp complements the work developed by the national and regional biotrade programmes currently btfp supports value chains in the following sectors natural ingredients ecotourism wildlife for pet trade native cocoa tropical flowers and foliage crocodile leather and meat ornamental and edible fish lucas assunção chief unctad biodiversity and climate change section e mail lucas assuncao unctad org  .",,,"D0218|C0182","The Bio Trade Initiative|Socio-Economic Improvement Through the Development of Ecotourism of 20 Families Living in the Wetlands of La Segua and La Sabana, Canton Chone, Provincia de Manabì"
"17","I0036","COMPACT (Community Management of Protected Areas for Conservation)","O0026/COU|O0136/DON|O0112/CON|","1","The Community Management of Protected Areas for Conservation (COMPACT) is a jointly funded project of the United Nations Foundation (UNF) and the UNDP/Global Environment Facility Small Grants Programme (SGP). The objective of COMPACT has been to demonstrate how community-based initiatives can significantly increase the effectiveness of biodiversity conservation in natural World Heritage Sites (WHS) by adding value to existing projects and programmes. A key challenge when COMPACT began in 2000 was that many natural WH sites remained better known internationally than locally. In Phase I between 2000-2004, COMPACT successfully piloted its approach in six WH sites namely: Belize Barrier Reef WHS, Belize; Mornes Trois Pitons WHS, Dominica; Mount Kenya WHS, Kenya; Sian Ka?an WHS, Mexico; Puerto Princesa Subterranean River WHS, Philippines; and Mount Kilimanjaro WHS, Tanzania.<BR>COMPACT Phase I was originally approved as a four-year demonstration programme from 2000 to 2004. Implementation of Phase II of the programme was initiated in 2005 with the addition of two new WH sites: Djoudj/Djawling transboundary Biosphere Reserve between Senegal and Mauritania; and the ?Fôrets seches? tentative list WH nomination landscape in South-West Madagascar.<BR>Starting in 2009, the World Heritage Local Ecological Entrepreneurship Program (WH-LEEP) has begun to leverage the UN Foundation and SGP?s current COMPACT partnership with Conservation International?s expertise in small/medium-sized enterprise development via Verde Ventures. The programme is now complementing COMPACT?s support to grantees and partner organisations, as well as SGP and UNDP?s approach to local capacity building by providing technical assistance and affordable capital directly to target enterprises.",,"002--|019-419-|142--|","199900","0","Terence Hay-Edie&#8232;<BR>E-mail: terence.hay-edie@undp.org,&#8232;Phone: +1 (212) 906 5079&#8232;<BR>Neel Inamdar&#8232;<BR>E-mail: ninamdar@conservation.org,&#8232;Phone: +1 (703) 341-2605","http://sgp.undp.org/index.cfm?module=ActiveWeb&page=WebPage&s=compact_1",".  compact community management of protected areas for conservation the community management of protected areas for conservation compact is a jointly funded project of the united nations foundation unf and the undp global environment facility small grants programme sgp the objective of compact has been to demonstrate how community based initiatives can significantly increase the effectiveness of biodiversity conservation in natural world heritage sites whs by adding value to existing projects and programmes a key challenge when compact began in 2000 was that many natural wh sites remained better known internationally than locally in phase i between 2000 2004 compact successfully piloted its approach in six wh sites namely belize barrier reef whs belize; mornes trois pitons whs dominica; mount kenya whs kenya; sian ka?an whs mexico; puerto princesa subterranean river whs philippines; and mount kilimanjaro whs tanzania compact phase i was originally approved as a four year demonstration programme from 2000 to 2004 implementation of phase ii of the programme was initiated in 2005 with the addition of two new wh sites djoudj djawling transboundary biosphere reserve between senegal and mauritania; and the ?fôrets seches? tentative list wh nomination landscape in south west madagascar starting in 2009 the world heritage local ecological entrepreneurship program wh leep has begun to leverage the un foundation and sgp?s current compact partnership with conservation international?s expertise in small medium sized enterprise development via verde ventures the programme is now complementing compact?s support to grantees and partner organisations as well as sgp and undp?s approach to local capacity building by providing technical assistance and affordable capital directly to target enterprises terence hay edie&#8232; e mail terence hay edie undp org &#8232;phone 1 212 906 5079&#8232; neel inamdar&#8232; e mail ninamdar conservation org &#8232;phone 1 703 341 2605  .",,,"C0192|C0191|C0189|C0188|C0187","Political Ecologies in Action, Puerto-Princesa Subterranean River National Park, Philippines|Mobilizing Policy Support, Mt Kilimanjaro National Park, Tanzania|Tourism and Agriculture in the Buffer Zone, Morne Trois Pitons National Park, Dominica|Community Innovations in a Landscape Context, Sian Ka'an Biosphere Reserve, Mexico|Fisher-Folk Monitoring of Marine Natural Resources, Belize"
"18","I0024","Congo Basin Forest Partnership (CBFP)","O0365/DON|","1","The Congo Basin Forest Partnership (CBFP) was created to protect the invaluable forest area of the Congo Basin. CBPF brings together governments, international organisations, non-governmental environmental organisations, industry, and civil society in a strong international partnership to manage the Congo Basin in a sustainable manner. The goals of CBFP are to:<BR>•	provide people with sustainable means of livelihood through well-managed forestry concessions, sustainable agriculture, and integrated ecotourism programs;<BR>•	improve forest and natural resource governance by using community-based management, combating illegal logging, and enforcing anti-poaching laws;<BR>•	help the Congo Basin countries develop a network of effectively managed parks, protected areas, and ecological corridors.","1. Development of community enterprises linked to landscape conservation.<BR>2. Adoption and strengthening of legislation related to natural resource management, including protected areas and forestry.","002-017-178|002-017-140|002-017-180|002-017-120|002-017-226|002-017-266|002-014-108|002-017-148|002-014-646|002-017-678|","200200","0","Herbert Christ<BR>E-mail:&#8232;herbert.christ@gtz.de;&#8232;Phone: +49-6196 79-1282&#8232;<BR>Cornelia Seegers Sylla<BR>E-mail:&#8232;cornelia.seegers@gtz.de;&#8232;Phone: + 49-6196-3383","http://www.cbfp.org/",".  congo basin forest partnership cbfp the congo basin forest partnership cbfp was created to protect the invaluable forest area of the congo basin cbpf brings together governments international organisations non governmental environmental organisations industry and civil society in a strong international partnership to manage the congo basin in a sustainable manner the goals of cbfp are to •	provide people with sustainable means of livelihood through well managed forestry concessions sustainable agriculture and integrated ecotourism programs; •	improve forest and natural resource governance by using community based management combating illegal logging and enforcing anti poaching laws; •	help the congo basin countries develop a network of effectively managed parks protected areas and ecological corridors 1 development of community enterprises linked to landscape conservation 2 adoption and strengthening of legislation related to natural resource management including protected areas and forestry herbert christ e mail &#8232;herbert christ gtz de;&#8232;phone 49 6196 79 1282&#8232; cornelia seegers sylla e mail &#8232;cornelia seegers gtz de;&#8232;phone 49 6196 3383  .",,,NULL,NULL
"19","I0044","Improving the Lives of People in Forests","O0389/|","1","The International Union of Forestry Research Organizations (IUFRO) constituted in 2007 a special Task Force on ‘Improving the Lives of People in Forests’. The Task Force is composed of respected researchers and activists addressing issues of human well being in forests, coming from a variety of disciplines, countries, and ethnic backgrounds.<BR>This Task Force recognises that people living in forests often have serious disadvantages – in terms of wealth, power, health, human rights – vis a vis non-forest dwellers. One of the main activities of this Task Force is to pull together materials that will help others work more effectively with peoples living in and around forests, to contribute to improving this inequitable situation. <BR>The Task force, Improving the Lives of People in Forests, finished its official IUFRO work at the 2010 IUFRO World Congress. Its work has been taken up by IUFRO’s Division 6.","The following are some of the outputs of the Task force, Improving the Lives of People in Forest:<BR>-	seven books have been published in CIFOR’s ACM Series;<BR>-	two policy briefs have been published (one on ACM and Climate Change and one on REDD and Indigenous People);<BR>-	the Task force collaborated with two other IUFRO Task Forces to present a panel at the World Forestry Congress in 2009;<BR>-	a website has been initiated and maintained with many relevant materials, available both through CIFOR and IUFRO’s main pages","002--|019--|142--|150--|009--|","200700","201000","Carol Pierce Colfer<BR>E-mail: c.colfer@cgiar.org","http://www.cifor.cgiar.org/livesinforests/_ref/home/index.htm",".  improving the lives of people in forests the international union of forestry research organizations iufro constituted in 2007 a special task force on ‘improving the lives of people in forests’ the task force is composed of respected researchers and activists addressing issues of human well being in forests coming from a variety of disciplines countries and ethnic backgrounds this task force recognises that people living in forests often have serious disadvantages – in terms of wealth power health human rights – vis a vis non forest dwellers one of the main activities of this task force is to pull together materials that will help others work more effectively with peoples living in and around forests to contribute to improving this inequitable situation the task force improving the lives of people in forests finished its official iufro work at the 2010 iufro world congress its work has been taken up by iufro’s division 6 the following are some of the outputs of the task force improving the lives of people in forest 	seven books have been published in cifor’s acm series; 	two policy briefs have been published one on acm and climate change and one on redd and indigenous people ; 	the task force collaborated with two other iufro task forces to present a panel at the world forestry congress in 2009; 	a website has been initiated and maintained with many relevant materials available both through cifor and iufro’s main pages carol pierce colfer e mail c colfer cgiar org  .",,,NULL,NULL
"20","I0028","Sustaining Local Food Systems, Agricultural Biodiversity and Livelihoods","O0040/EDI|","1","Sustaining Local Food Systems, Agricultural Biodiversity and Livelihoods is a research initiative that aims to analyse how and under what conditions can decentralised governance, farmer participation and capacity building promote the adaptive management of agricultural biodiversity in the context of local food systems and livelihoods. This will be achieved by:<BR>•	identifying forms of decentralised governance, co-management agreements, and markets and property right institutions that can sustain agricultural biodiversity and livelihoods;<BR>•	strengthening the capacity of farmers and other actors, including producer organisations, and in doing so increase their benefits, and promote awareness and responsible action;<BR>•	developing indicators to analyse the links between livelihoods and agricultural biodiversity, with a special emphasis on local definitions of well being, equity and culture;<BR>•	applying participatory assessment methodology for valuations of agricultural biodiversity and the various systems (e.g. livelihoods, food and rural development) in which local biodiversity is embedded;<BR>•	making recommendations on effective policies and processes that will help build capacity and institutionalise the adaptive management of agricultural biodiversity in the context of localised food systems and rural economies.","Through participatory research and dialogue in India, Iran, Peru and Indonesia a range of impacts have been achieved:<BR>•	International Farmers Exchange for Mutual Learning on Privatisation of Knowledge and Seeds;<BR>•	a citizens’ jury was initiated in Andhra Pradesh (India) to include small farmers and indigenous people in participatory assessments of different visions of food, farming and rural development futures;<BR>•	a cultural and technical exchange was organised between Indian farmers and indigenous communities in the Andes of Peru. The farmer to farmer exchange focused on capacity building for the local level management of agricultural biodiversity, the documentation of indigenous knowledge in the form of Community Biodiversity Registers and training in digital video technology;<BR>•	support and conceptual inputs were provided to the Growing Diversity Initiative and an international workshop in Brazil, in which participants reviewed emerging issues and challenges for the decentralised management of agricultural biodiversity in Africa, Asia and Latin America.",,"200100","0","Michel Pimbert, Project Co-ordinator, IIED<BR>E-mail: michel.pimbert@iied.org","http://www.iied.org/natural-resources/key-issues/food-and-agriculture/sustaining-local-food-systems-agricultural-biodiversity-and-livelihoods",".  sustaining local food systems agricultural biodiversity and livelihoods sustaining local food systems agricultural biodiversity and livelihoods is a research initiative that aims to analyse how and under what conditions can decentralised governance farmer participation and capacity building promote the adaptive management of agricultural biodiversity in the context of local food systems and livelihoods this will be achieved by •	identifying forms of decentralised governance co management agreements and markets and property right institutions that can sustain agricultural biodiversity and livelihoods; •	strengthening the capacity of farmers and other actors including producer organisations and in doing so increase their benefits and promote awareness and responsible action; •	developing indicators to analyse the links between livelihoods and agricultural biodiversity with a special emphasis on local definitions of well being equity and culture; •	applying participatory assessment methodology for valuations of agricultural biodiversity and the various systems e g livelihoods food and rural development in which local biodiversity is embedded; •	making recommendations on effective policies and processes that will help build capacity and institutionalise the adaptive management of agricultural biodiversity in the context of localised food systems and rural economies through participatory research and dialogue in india iran peru and indonesia a range of impacts have been achieved •	international farmers exchange for mutual learning on privatisation of knowledge and seeds; •	a citizens’ jury was initiated in andhra pradesh india to include small farmers and indigenous people in participatory assessments of different visions of food farming and rural development futures; •	a cultural and technical exchange was organised between indian farmers and indigenous communities in the andes of peru the farmer to farmer exchange focused on capacity building for the local level management of agricultural biodiversity the documentation of indigenous knowledge in the form of community biodiversity registers and training in digital video technology; •	support and conceptual inputs were provided to the growing diversity initiative and an international workshop in brazil in which participants reviewed emerging issues and challenges for the decentralised management of agricultural biodiversity in africa asia and latin america michel pimbert project co ordinator iied e mail michel pimbert iied org  .",,,NULL,NULL
