"21","I0029","Forest Governance Learning Group (FGLG)","O0040/EDI|","1","The Forest Governance Learning Group (FGLG) is an informal alliance of in-country teams and international partners, currently active in seven African and three Asian countries, facilitated by the International Institute for Environment and Development (IIED) and in collaboration with RECOFTC. FGLG aims to connect those marginalised from forest governance to those controlling it, and to help policy makers make better policies, doers do better and rights-holders gain more.<BR>Four connected parts to the work in each country:<BR>• team of ‘governance-connected’ individuals from a mix of agencies with experience and ideas;<BR>• policy work on forest livelihood problems due to people being excluded from decisions;<BR>• development of practical guidance and tools for making progress;<BR>• creating and taking opportunities to make governance improvements.<BR>Inter-country work is also a priority to achieve creative transfers of insight from one location to another, and to install findings in international policy processes.","Key outputs to date:<BR>-	10 in-country teams of forest governance advocates continuing to be active in Ghana, Cameroon, Uganda, Malawi, Mozambique, South Africa, Tanzania, Indonesia, India and Vietnam – and preparations begun for a team in Tanzania;<BR>-	major learning events in Ghana, South Africa, Uganda, India, Malawi and Indonesia on social justice in forestry, involving participants from all the country teams and other international players;<BR>-	66 policy research outputs and tools;<BR>-	49 press, TV and radio advocacy outputs;<BR>-	international collaboration with more than 21 international organisations and participation in more than 20 international forums.<BR>Impacts to date include:<BR>-	president in Uganda forced to back down from give-away of forest reserves to agribusiness after severe pressure from ‘peoples power’;<BR>-	high-level action on illegal logging and Chinese investment in Mozambique;<BR>-	rights and governance reform installed back on the agenda in Ghana by shaping the Voluntary Partnership Agreement on legal timber with the EC;<BR>-	increased understanding of the economic value of charcoal in Malawi, leading to policy reviews and improved forest governance;<BR>-	governance frameworks more astutely enabling community forestry in Vietnam.","002--|142--|","200308","0","James Mayers, Natural Resources Group Head<BR>E-mail: james.mayers@iied.org","http://www.iied.org/natural-resources/key-issues/forestry/forest-governance-learning-group",".  forest governance learning group fglg the forest governance learning group fglg is an informal alliance of in country teams and international partners currently active in seven african and three asian countries facilitated by the international institute for environment and development iied and in collaboration with recoftc fglg aims to connect those marginalised from forest governance to those controlling it and to help policy makers make better policies doers do better and rights holders gain more four connected parts to the work in each country • team of ‘governance connected’ individuals from a mix of agencies with experience and ideas; • policy work on forest livelihood problems due to people being excluded from decisions; • development of practical guidance and tools for making progress; • creating and taking opportunities to make governance improvements inter country work is also a priority to achieve creative transfers of insight from one location to another and to install findings in international policy processes key outputs to date 	10 in country teams of forest governance advocates continuing to be active in ghana cameroon uganda malawi mozambique south africa tanzania indonesia india and vietnam – and preparations begun for a team in tanzania; 	major learning events in ghana south africa uganda india malawi and indonesia on social justice in forestry involving participants from all the country teams and other international players; 	66 policy research outputs and tools; 	49 press tv and radio advocacy outputs; 	international collaboration with more than 21 international organisations and participation in more than 20 international forums impacts to date include 	president in uganda forced to back down from give away of forest reserves to agribusiness after severe pressure from ‘peoples power’; 	high level action on illegal logging and chinese investment in mozambique; 	rights and governance reform installed back on the agenda in ghana by shaping the voluntary partnership agreement on legal timber with the ec; 	increased understanding of the economic value of charcoal in malawi leading to policy reviews and improved forest governance; 	governance frameworks more astutely enabling community forestry in vietnam james mayers natural resources group head e mail james mayers iied org  .",,,NULL,NULL
"22","I0030","Poverty-Forest Linkages Toolkit","O0335/|O0014/EDI|O0046/CON|O0057/EDI|O0336/|","1","In May 2004, representatives from CIFOR, IUCN, ODI, PROFOR and Winrock met in Nairobi to form a working group on Poverty-Forest Linkages. This working group found relatively little analysis of the contribution of forests to rural livelihoods, nor of the measures required to capture or expand the potential. Field work began to prepare case studies in eight countries to serve as source material for a toolkit. The main objective of this toolkit is to facilitate appropriate inclusion of poverty-forest linkages into the PRSP and similar planning strategies and programs, such as national forest programs.<BR>The first draft of the Toolkit was completed in April 2007, and was based on piloting and field testing in three different locations in Indonesian Papua (highlands, lowlands and a mangrove area) and in Tanzania. The Poverty-Forest Linkages Toolkit includes:<BR>•	a set of rapid appraisal methods to gather information on economic as well as other contributions from forests to households, especially the poor;<BR>•	methods for analyzing field data for the potential role of forests in reducing poverty and vulnerability and policy options for improving the contribution of forests to rural livelihoods;<BR>•	suggestions for how to frame the results so as to be relevant to the planners, government agencies and other institutions and organisations, at both local and national levels;<BR>•	an explanation of the PRSP process and identification of the strategies and skills needed for influencing the PRSP process (including potential entry points for forestry); and<BR>•	a field manual to support training and capacity building for local government forest officials, collection of information to understand forest dependence locally and hands-on application of participatory assessment tools.","•	After piloting was completed in 2008, PROFOR developed a field-compatible version of the toolkit and started providing training in its use. Over 50 World Bank staff and external participants were trained during the World Bank’s annual Sustainable Development Network Forum in March 2009. The toolkit was also disseminated at the XIII World Forestry Congress in October 2009. The training of a dozen National Forest Programme Facility coaches at FAO in February 2010 concluded PROFOR’s direct engagement with the toolkit and transferred product and skills to the NFP Facility for roll out in their country activities.<BR>•	Ongoing PROFOR activities such as the study of desert cloud forests in Yemen and Oman are making use of the toolkit to collect relevant data and analyse the impact of overexploitation of natural resources and climate change on livelihoods.","002-014-834|142-062-356|142-062-524|009-054-598|142-035-360|142-035-418|019-013-340|019-013-484|","200400","201000","Laura Ivers&#8232;<BR>E-mail: Laivers@worlbank.org","http://www.profor.info/profor/node/3",".  poverty forest linkages toolkit in may 2004 representatives from cifor iucn odi profor and winrock met in nairobi to form a working group on poverty forest linkages this working group found relatively little analysis of the contribution of forests to rural livelihoods nor of the measures required to capture or expand the potential field work began to prepare case studies in eight countries to serve as source material for a toolkit the main objective of this toolkit is to facilitate appropriate inclusion of poverty forest linkages into the prsp and similar planning strategies and programs such as national forest programs the first draft of the toolkit was completed in april 2007 and was based on piloting and field testing in three different locations in indonesian papua highlands lowlands and a mangrove area and in tanzania the poverty forest linkages toolkit includes •	a set of rapid appraisal methods to gather information on economic as well as other contributions from forests to households especially the poor; •	methods for analyzing field data for the potential role of forests in reducing poverty and vulnerability and policy options for improving the contribution of forests to rural livelihoods; •	suggestions for how to frame the results so as to be relevant to the planners government agencies and other institutions and organisations at both local and national levels; •	an explanation of the prsp process and identification of the strategies and skills needed for influencing the prsp process including potential entry points for forestry ; and •	a field manual to support training and capacity building for local government forest officials collection of information to understand forest dependence locally and hands on application of participatory assessment tools •	after piloting was completed in 2008 profor developed a field compatible version of the toolkit and started providing training in its use over 50 world bank staff and external participants were trained during the world bank’s annual sustainable development network forum in march 2009 the toolkit was also disseminated at the xiii world forestry congress in october 2009 the training of a dozen national forest programme facility coaches at fao in february 2010 concluded profor’s direct engagement with the toolkit and transferred product and skills to the nfp facility for roll out in their country activities •	ongoing profor activities such as the study of desert cloud forests in yemen and oman are making use of the toolkit to collect relevant data and analyse the impact of overexploitation of natural resources and climate change on livelihoods laura ivers&#8232; e mail laivers worlbank org  .",,,NULL,NULL
"23","I0054","Intergovernmental Science-Policy Platform on Biodiversity and Ecosystem Services (IPBES)","O0428/COG|","1","The Executive Director of UNEP convened the 1st Ad Hoc Intergovernmental and Multi-Stakeholder meeting on an Intergovernmental Science-Policy Platform on Biodiversity and Ecosystem Services (IPBES) in Malaysia, in November 2008. There was a general agreement among participants to the meeting that there is a genuine need to strengthen the science-policy interface. Participants felt that the main areas of potential work for the platform or panel were:<BR>- early warning and horizon scanning;<BR>- multi-scale assessments;<BR>- policy information;<BR>- capacity building.<BR>Since 2008, two further meetings have taken place to discuss the possible governance structure and the role of a potential new mechanism. The third and final intergovernmental and multi-stakeholder meeting on IPBES was held at the Busan Exhibition and Conference Center, Busan, Republic of Korea, from 7-11 June 2010. After five days of negotiations delegates adopted the Busan Outcome document that sets the path for establishing an IPBES.",,,"201000","0","IPBES<BR>E-mail: ipbes.unep@unep.org<BR>Phone: + 254 20 762 5135","http://ipbes.net",".  intergovernmental science policy platform on biodiversity and ecosystem services ipbes the executive director of unep convened the 1st ad hoc intergovernmental and multi stakeholder meeting on an intergovernmental science policy platform on biodiversity and ecosystem services ipbes in malaysia in november 2008 there was a general agreement among participants to the meeting that there is a genuine need to strengthen the science policy interface participants felt that the main areas of potential work for the platform or panel were early warning and horizon scanning; multi scale assessments; policy information; capacity building since 2008 two further meetings have taken place to discuss the possible governance structure and the role of a potential new mechanism the third and final intergovernmental and multi stakeholder meeting on ipbes was held at the busan exhibition and conference center busan republic of korea from 7 11 june 2010 after five days of negotiations delegates adopted the busan outcome document that sets the path for establishing an ipbes ipbes e mail ipbes unep unep org phone 254 20 762 5135  .",,,NULL,NULL
"24","I0056","Central African Regional Program for the Environment (CARPE)","O0100/DOD|","1","The Central African Regional Program for the Environment (CARPE) is a United States Agency for International Development (USAID) initiative aimed at promoting sustainable natural resource management in the Congo Basin. The Congo Basin forest is the second largest contiguous moist tropical forest in the world and plays a key role in securing the livelihoods of Central African citizens. The forest also provides critical habitat for biodiversity conservation and supplies vital regional and worldwide ecological services. In recognition of the important role of the Congo Basin forest and amidst the increasing pressures facing the Congo Basin forest, CARPE works to reduce the rate of forest degradation and loss of biodiversity by supporting increased local, national, and regional natural resource management capacity.","In Cameroon support has been given to WWF for their Jengi project, which includes a CBNRM component. CARPE has also worked on the national scale, lobbying for reforms to improve governance for conservation. This has been done through national focal points and a country team that works closely with the relevant ministries. Achievements include support for the process to establish norms for management of Community Hunting Zones, and support for civil society engagement in reforms to community forestry legislation. Such reforms are expected to improve the enabling environment for sustainable resource use and livelihood benefits on the ground. CARPE supports two important transboundary conservation initiatives that involve Cameroon. These are the Tri National de la Sangha (TNS; between Cameroon, CAR and Congo) and the Dja-Minkebe-Odzala Tri-National (TRIDOM; between Cameroon, Congo and Gabon). Both include livelihood components.","002-014-108|002-017-120|002-017-140|002-017-180|002-017-226|002-017-266|002-017-178|002-014-646|002-017-678|","0","0","John B. Flynn, CARPE Director&#8232;USAID Bureau for Africa&#8232;198 Isiro Ave., Kinshasa, Gombe<BR>E-mail: joflynn@usaid.gov","http://carpe.umd.edu",".  central african regional program for the environment carpe the central african regional program for the environment carpe is a united states agency for international development usaid initiative aimed at promoting sustainable natural resource management in the congo basin the congo basin forest is the second largest contiguous moist tropical forest in the world and plays a key role in securing the livelihoods of central african citizens the forest also provides critical habitat for biodiversity conservation and supplies vital regional and worldwide ecological services in recognition of the important role of the congo basin forest and amidst the increasing pressures facing the congo basin forest carpe works to reduce the rate of forest degradation and loss of biodiversity by supporting increased local national and regional natural resource management capacity in cameroon support has been given to wwf for their jengi project which includes a cbnrm component carpe has also worked on the national scale lobbying for reforms to improve governance for conservation this has been done through national focal points and a country team that works closely with the relevant ministries achievements include support for the process to establish norms for management of community hunting zones and support for civil society engagement in reforms to community forestry legislation such reforms are expected to improve the enabling environment for sustainable resource use and livelihood benefits on the ground carpe supports two important transboundary conservation initiatives that involve cameroon these are the tri national de la sangha tns; between cameroon car and congo and the dja minkebe odzala tri national tridom; between cameroon congo and gabon both include livelihood components john b flynn carpe director&#8232;usaid bureau for africa&#8232;198 isiro ave kinshasa gombe e mail joflynn usaid gov  .",,,NULL,NULL
"25","I0055","International Gorilla Conservation Programme (IGCP)","O0002/CON|O0022/CON|O0117/CON|","1","The International Gorilla Conservation Programme (IGCP) is a joint initiative of WWF, Fauna and Flora International (FFI) and the African Wildlife Foundation (AWF). Its aim is to ensure the conservation of mountain gorillas and their regional afromontane forest habitat in Rwanda, Uganda and the Democratic Republic of Congo (DRC).<BR>IGCP’s ultimate aim is to protect the afromontane forest and the many species it harbours, by ensuring that it is managed sustainably and by tackling the threats to its survival. In order to achieve this goal, it has set itself twin objectives: to reduce the threats to mountain gorillas and their forest habitat by creating widespread support for conservation among local communities, interest groups and the general public; and to improve the protection of gorillas and their habitat by encouraging the relevant authorities to adopt a consistent, collaborative approach to conservation policy and legislation throughout the region.<BR>There is a growing recognition among conservationists that a regional, ecosystem-based approach to management is crucial to effective long-term species and habitat protection, particularly in areas of political instability. One of IGCP’s main objectives is to increase collaboration between the protected area authorities and their partners in the region. The programme provides a mechanism for the respective countries to develop a regional approach to the conservation of a shared habitat.","1. As part of its Improving Livelihoods programme, IGCP has several projects in eastern DRC. The feasibility of developing a community tourism lodge is being explored but depends on improved security in the area. IGCP has worked with the Union des Apiculteurs du Secteur Mikeno et Nyamulagira to develop beekeeping skills and relocate hives outside the Virunga NP. Honey and other bee products are now sold to boost income. IGCP has also helped solicit donations from the World Food Programme to meet basic survival needs in eastern DRC. Help has been given to local people to build a 1 meter high stone wall around PN Virunga to reduce crop raiding and human-wildlife conflict. Meetings have been held to promote community participation in conservation management.<BR>2. IGCP is very active working with communities around PN Volcans in Rwanda, home to mountain gorillas, on alternative livelihoods projects such as beekeeping. One such project is the upmarket tourist development Sabinyo lodge, which is operated by the private sector but owned by SACOLA, a community institution they helped to found. This was funded with money from USAID and the private sector partner. In 2009 the revenue generated was $300,000, of which $270,000 went back to the community (albeit shared between 300,000 people). IGCP works with the Forum des Apicultuers des Volcans to promote apiculture around PNV, and has helped to build a stone wall to reduce crop raiding from buffaloes and other animals.<BR>3. IGCP is very active in Uganda, and has poverty alleviation as a major focus of its work around Bwindi and Mgahinga NPs, based on the rationale that poverty is a major threat to the conservation status of the parks and the mountain gorillas living in them. IGCP has supported various Integrated Conservation and Development interventions in the area, including support for community based tourism enterprises, alternative livelihoods such as beekeeping, and institutional support for the revenue sharing programme that is designed to ensure local people benefit from park tourism fees. Recently, as in Rwanda, IGCP has been a key partner in the development of a luxury tourism lodge that is a Public-Private Partnership between a local community institution and a private sector operator. This is intended to generate development benefits for local people through the distribution of a bed-night levy. The project has been successful so far in generating revenue, but has been beset by political conflict over the distribution of resources and preferential access to gorilla tracking permits for the lodge.","002-014-646|002-014-800|002-017-180|","199100","0",,"http://www.igcp.org",".  international gorilla conservation programme igcp the international gorilla conservation programme igcp is a joint initiative of wwf fauna and flora international ffi and the african wildlife foundation awf its aim is to ensure the conservation of mountain gorillas and their regional afromontane forest habitat in rwanda uganda and the democratic republic of congo drc igcp’s ultimate aim is to protect the afromontane forest and the many species it harbours by ensuring that it is managed sustainably and by tackling the threats to its survival in order to achieve this goal it has set itself twin objectives to reduce the threats to mountain gorillas and their forest habitat by creating widespread support for conservation among local communities interest groups and the general public; and to improve the protection of gorillas and their habitat by encouraging the relevant authorities to adopt a consistent collaborative approach to conservation policy and legislation throughout the region there is a growing recognition among conservationists that a regional ecosystem based approach to management is crucial to effective long term species and habitat protection particularly in areas of political instability one of igcp’s main objectives is to increase collaboration between the protected area authorities and their partners in the region the programme provides a mechanism for the respective countries to develop a regional approach to the conservation of a shared habitat 1 as part of its improving livelihoods programme igcp has several projects in eastern drc the feasibility of developing a community tourism lodge is being explored but depends on improved security in the area igcp has worked with the union des apiculteurs du secteur mikeno et nyamulagira to develop beekeeping skills and relocate hives outside the virunga np honey and other bee products are now sold to boost income igcp has also helped solicit donations from the world food programme to meet basic survival needs in eastern drc help has been given to local people to build a 1 meter high stone wall around pn virunga to reduce crop raiding and human wildlife conflict meetings have been held to promote community participation in conservation management 2 igcp is very active working with communities around pn volcans in rwanda home to mountain gorillas on alternative livelihoods projects such as beekeeping one such project is the upmarket tourist development sabinyo lodge which is operated by the private sector but owned by sacola a community institution they helped to found this was funded with money from usaid and the private sector partner in 2009 the revenue generated was $300 000 of which $270 000 went back to the community albeit shared between 300 000 people igcp works with the forum des apicultuers des volcans to promote apiculture around pnv and has helped to build a stone wall to reduce crop raiding from buffaloes and other animals 3 igcp is very active in uganda and has poverty alleviation as a major focus of its work around bwindi and mgahinga nps based on the rationale that poverty is a major threat to the conservation status of the parks and the mountain gorillas living in them igcp has supported various integrated conservation and development interventions in the area including support for community based tourism enterprises alternative livelihoods such as beekeeping and institutional support for the revenue sharing programme that is designed to ensure local people benefit from park tourism fees recently as in rwanda igcp has been a key partner in the development of a luxury tourism lodge that is a public private partnership between a local community institution and a private sector operator this is intended to generate development benefits for local people through the distribution of a bed night levy the project has been successful so far in generating revenue but has been beset by political conflict over the distribution of resources and preferential access to gorilla tracking permits for the lodge  .",,,NULL,NULL
