"1","I0001","Poverty Environment Network (PEN)","O0014/EDI|","1","PEN is an international research network and coordinated research effort on poverty, environment and forest resources. PEN aims to explore the role that forests play in poverty alleviation through the systematic collection of socio-economic data in a variety of tropical ecosystems. PEN will do this by looking at several dimensions of the forest-poverty link: the role in rural livelihoods; the role for different groups; the role in different forest environments; the role in different institutional contexts; the role in different market contexts.","1. Global data set: 38 case studies in 25 countries, with more than 9000 households included. Detailed quarterly data on forest use and other socioeconomic variables, using a common questionnaire.<BR>2. Global-comparative analysis: The global analysis will explain how forests contribute to subsistence and cash income, asset building, security and welfare, and how different policies, management systems and market conditions affect forest use and livelihoods.<BR>3. Thematic in-depth studies: Each individual study will have its own focus, and will yield critical insights that go well beyond what one can get in the global analysis.<BR>4. Policy analysis: The individual studies and the global syntheses will be designed to produce concrete recommendations that can be fed into policy processes at national and international levels.<BR>5. Improved methodologies and capacity building: A manual with tested questionnaires and research guidelines and have been developed, A methods book ?Measuring Livelihoods and Environmental Dependence? will be published by Earthscan in early 2011. Most of the PEN partners are PhD students from developing countries. The PEN experience will also feed into the survey work undertaken by FAO and the World Bank.<BR>As of August 2010, data collection is completed, the global data set is under construction, and some preliminary analyses have been undertaken. A major international conference will be held in June 2011 in London. The project will last until 2011/12. The project is funded by ERSC (DFID), Danida, AMA BASIS (USAID), and IFS, in addition to CIFOR and the partners host institutions.","002--|019--|142--|","200409","201100","Arild Angelsen, PEN coordinator <BR>E-mail: arild.angelsen@umb.no","www.cifor.cgiar.org/pen",".  poverty environment network pen pen is an international research network and coordinated research effort on poverty environment and forest resources pen aims to explore the role that forests play in poverty alleviation through the systematic collection of socio economic data in a variety of tropical ecosystems pen will do this by looking at several dimensions of the forest poverty link the role in rural livelihoods; the role for different groups; the role in different forest environments; the role in different institutional contexts; the role in different market contexts 1 global data set 38 case studies in 25 countries with more than 9000 households included detailed quarterly data on forest use and other socioeconomic variables using a common questionnaire 2 global comparative analysis the global analysis will explain how forests contribute to subsistence and cash income asset building security and welfare and how different policies management systems and market conditions affect forest use and livelihoods 3 thematic in depth studies each individual study will have its own focus and will yield critical insights that go well beyond what one can get in the global analysis 4 policy analysis the individual studies and the global syntheses will be designed to produce concrete recommendations that can be fed into policy processes at national and international levels 5 improved methodologies and capacity building a manual with tested questionnaires and research guidelines and have been developed a methods book ?measuring livelihoods and environmental dependence? will be published by earthscan in early 2011 most of the pen partners are phd students from developing countries the pen experience will also feed into the survey work undertaken by fao and the world bank as of august 2010 data collection is completed the global data set is under construction and some preliminary analyses have been undertaken a major international conference will be held in june 2011 in london the project will last until 2011 12 the project is funded by ersc dfid danida ama basis usaid and ifs in addition to cifor and the partners host institutions arild angelsen pen coordinator e mail arild angelsen umb no  .",,,"B1698","Poverty, Environmental Income and Rural Inequality: A Case Study from Zimbabwe"
"2","I0002","UNDP/UNEP Poverty Environment Initiative","O0146/DOU|","1","In 2005 UNDP and UNEP formed a global partnership and merged their poverty-environment programmes into one integrated programme - the UNDP/UNEP Poverty and Environment Initiative (PEI). The core focus of PEI is to support country-led efforts to integrate the environmental concerns of poor and vulnerable groups into policy and planning processes for poverty reduction and pro-poor growth. With both financial and technical support, UNDP and UNEP assist government decision-makers and a wide range of other stakeholders to manage the environment in a way that improves livelihoods and leads to sustainable growth. The PEI works with key government partners to raise awareness, influence policymaking and strengthen the mainstreaming of poverty-environment into budget processes, sector programmes and sub-national planning. The overall aim is to bring about lasting institutional change and to catalyse key actors to increase investment in pro-poor environmental and natural resource management.","The UNDP-UNEP Poverty-Environment Initiative has jointly supported the implementation of country level mainstreaming programmes in nine countries in Africa and two countries in Asia and the Pacific with the aim of increasing the capacity of governments to mainstream environment into national development processes and their implementation. Although all country programmes are similar in that they all employ the three-phased approach with the aim of developing a sustainable poverty-environment mainstreaming programme, each country programme is tailored to the specific needs and conditions of that country. Therefore the time-frame and the activities carried out under each programme can vary from country to country. <BR>The scale-up of the PEI is focused on building on the strengths of the current country programmes on a regional basis. In Africa, the PEI is aiming to add several more countries to the regional programme in the coming few years. Support to PEI country programmes is provided through the regional structures of UNDP and UNEP. <BR>As of 2010, the PEI is supporting programmes in 22 countries.<BR>PEI has had a long running involvement in great ape conservation and poverty reduction projects in Africa:<BR>?	PEI completed its first phase (mainstreaming environment into the PRSP) in Rwanda in 2007. The current focus is on capacity building at all levels of government. PEI in general is not considered to focus much on biodiversity, but in the Rwandan case there is considerable attention to this issue, particularly through mountain gorillas and tourism. <BR>?	Following successful integration of environmental issues into the PRSP, the current phase of PEI in Tanzania is focussed on capacity building, improving access to and utilisation of poverty-environment data and financing environmental targets in the Mkukuta PRSP. <BR>?	The overall objective of the PEI in Uganda is to integrate environmental concerns into policies, plans, programmes and budgeting processes both at local and national levels. Its specific objectives include raising awareness on the poverty-environmental linkages and bringing the linkages into development policies and poverty reduction strategies.","002--|019--|142--|150-151-|","200500","0","Victoria Luque	<BR>E-mail: victoria.luque@unep.org","http://www.unpei.org",".  undp unep poverty environment initiative in 2005 undp and unep formed a global partnership and merged their poverty environment programmes into one integrated programme the undp unep poverty and environment initiative pei the core focus of pei is to support country led efforts to integrate the environmental concerns of poor and vulnerable groups into policy and planning processes for poverty reduction and pro poor growth with both financial and technical support undp and unep assist government decision makers and a wide range of other stakeholders to manage the environment in a way that improves livelihoods and leads to sustainable growth the pei works with key government partners to raise awareness influence policymaking and strengthen the mainstreaming of poverty environment into budget processes sector programmes and sub national planning the overall aim is to bring about lasting institutional change and to catalyse key actors to increase investment in pro poor environmental and natural resource management the undp unep poverty environment initiative has jointly supported the implementation of country level mainstreaming programmes in nine countries in africa and two countries in asia and the pacific with the aim of increasing the capacity of governments to mainstream environment into national development processes and their implementation although all country programmes are similar in that they all employ the three phased approach with the aim of developing a sustainable poverty environment mainstreaming programme each country programme is tailored to the specific needs and conditions of that country therefore the time frame and the activities carried out under each programme can vary from country to country the scale up of the pei is focused on building on the strengths of the current country programmes on a regional basis in africa the pei is aiming to add several more countries to the regional programme in the coming few years support to pei country programmes is provided through the regional structures of undp and unep as of 2010 the pei is supporting programmes in 22 countries pei has had a long running involvement in great ape conservation and poverty reduction projects in africa ?	pei completed its first phase mainstreaming environment into the prsp in rwanda in 2007 the current focus is on capacity building at all levels of government pei in general is not considered to focus much on biodiversity but in the rwandan case there is considerable attention to this issue particularly through mountain gorillas and tourism ?	following successful integration of environmental issues into the prsp the current phase of pei in tanzania is focussed on capacity building improving access to and utilisation of poverty environment data and financing environmental targets in the mkukuta prsp ?	the overall objective of the pei in uganda is to integrate environmental concerns into policies plans programmes and budgeting processes both at local and national levels its specific objectives include raising awareness on the poverty environmental linkages and bringing the linkages into development policies and poverty reduction strategies victoria luque	 e mail victoria luque unep org  .",,,"D0210|D0034","Linking Poverty to Environmental Sustainability|UNDP/UNEP Poverty and Environment Initiative"
"3","I0003","Poverty Environment Partnership (PEP)",,"1","The Poverty Environment Partnership (PEP) was established in 2002 as an informal network of donor agencies, multilaterals and some research-focused international NGOs which is attempting to mainstream environment in development aid, in support of national and sector development planning in developing countries. The objectives of the partnership are to: <BR>?	build a consensus on the critical links between poverty and the environment, particularly that better environmental management is essential to lasting poverty reduction;<BR>?	review the activities of development agencies to build on common themes and address gaps in knowledge.<BR>Membership is open to development agencies and development banks with an interest in the relationship between poverty and the environment. PEP meets regularly (around every 6 months) with a rotating host and meetings often include invited participants from international NGOs or research centres.","The Fifteenth Poverty Environment Partnership (PEP 15) Meeting was held on 1 to 5 March 2010 in Malawi, and featured the theme \"Climate and Environment Mainstreaming and the Green Economy to achieve the Millennium Development Goals.\"","002--|019--|142--|","200209","0","Steve Bass<BR>E-mail: steve.bass@iied.org","http://www.povertyenvironment.net/pep/",".  poverty environment partnership pep the poverty environment partnership pep was established in 2002 as an informal network of donor agencies multilaterals and some research focused international ngos which is attempting to mainstream environment in development aid in support of national and sector development planning in developing countries the objectives of the partnership are to ?	build a consensus on the critical links between poverty and the environment particularly that better environmental management is essential to lasting poverty reduction; ?	review the activities of development agencies to build on common themes and address gaps in knowledge membership is open to development agencies and development banks with an interest in the relationship between poverty and the environment pep meets regularly around every 6 months with a rotating host and meetings often include invited participants from international ngos or research centres the fifteenth poverty environment partnership pep 15 meeting was held on 1 to 5 march 2010 in malawi and featured the theme climate and environment mainstreaming and the green economy to achieve the millennium development goals steve bass e mail steve bass iied org  .",,,"D0030","Poverty Environment Partnership"
"4","I0034","Poverty and Environment Program (PEP)","O0346/DON|","1","The Poverty and Environment Program (PEP) is a regional technical assistance project financed by the Poverty and Environment Fund (PEF), a multi-donor trust fund administered by ADB. The programme aims to accelerate learning about poverty-environment linkages and effective approaches for poverty reduction.","PEP is developing a fast-growing knowledge base that draws lessons from replicable and self-sustaining interventions implemented by ADB and its development partners in the Asia and Pacific region and globally. Through PEP, the Poverty Environment Net (www.povertyenvironment.net) was established as the mechanism for knowledge capture and outreach.<BR>The focal areas are:<BR>•	protection, conservation, and sustainable use of natural resources and ecosystem services;<BR>•	reduction of air and water pollution;<BR>•	disaster prevention and reduction of vulnerability to natural hazards.<BR>While capturing knowledge on poverty-environment relationships from experiences of past and ongoing projects of ADB and other development partners, PEP is also acquiring lessons and promoting effective responses toward environmental improvement and poverty reduction through its own small grants programme focusing on the following:<BR>•	Pilot interventions - activities that demonstrate innovative institutional arrangements, participatory approaches, technical solutions, or sustainable livelihoods with clear potential for successful replication, mainstreaming, and/or upscaling;<BR>•	Targeted analytical studies - focused studies, action research, and targeted activities aimed at removing specific policy, institutional, organisational, technical, and financial barriers to improved environmental management at the local level;<BR>•	Information dissemination - activities that focus on the sharing of lessons learned and best practices for addressing the environmental dimensions of poverty.","142--|","200400","0","E-mail: povertyenvironment@adb.org","http://www.adb.org/Projects/PEP",".  poverty and environment program pep the poverty and environment program pep is a regional technical assistance project financed by the poverty and environment fund pef a multi donor trust fund administered by adb the programme aims to accelerate learning about poverty environment linkages and effective approaches for poverty reduction pep is developing a fast growing knowledge base that draws lessons from replicable and self sustaining interventions implemented by adb and its development partners in the asia and pacific region and globally through pep the poverty environment net www povertyenvironment net was established as the mechanism for knowledge capture and outreach the focal areas are •	protection conservation and sustainable use of natural resources and ecosystem services; •	reduction of air and water pollution; •	disaster prevention and reduction of vulnerability to natural hazards while capturing knowledge on poverty environment relationships from experiences of past and ongoing projects of adb and other development partners pep is also acquiring lessons and promoting effective responses toward environmental improvement and poverty reduction through its own small grants programme focusing on the following •	pilot interventions activities that demonstrate innovative institutional arrangements participatory approaches technical solutions or sustainable livelihoods with clear potential for successful replication mainstreaming and or upscaling; •	targeted analytical studies focused studies action research and targeted activities aimed at removing specific policy institutional organisational technical and financial barriers to improved environmental management at the local level; •	information dissemination activities that focus on the sharing of lessons learned and best practices for addressing the environmental dimensions of poverty e mail povertyenvironment adb org  .",,,NULL,NULL
"5","I0022","Swedish International Biodiversity programme (SwedBio)","O0071/DON|","1","The Swedish International Biodiversity Programme (SwedBio) was initiated in 2002 by the Swedish International Development Cooperation Agency (Sida) and has until 2010 been a programme at Swedish Biodiversity Centre (CBM), but will from 2011 be a programme at Stockholm Resilience Centre (SRC) with a sub-agreement with CBM. Since the start of the programme, the evidence of the crucial role of biodiversity and ecosystem services for the poor and their livelihoods has been even more articulated in the light of climate change, and the options for win-win solutions for adaptation and mitigation to climate change, sustainable management of biodiversity and ecosystem services and strengthening of poor people?s livelihood. The links between human rights and the sustainable use of natural resources are a cornerstone in SwedBio?s work. For the phase 2011-2013 SwedBio will be an independent think-tank programme in the area of biodiversity, resilience and ecosystem services and international development cooperation, that will increase its emphasis on the knowledge interface role.<BR>SwedBio will have the following objectives for the programme phase 2011-2013:<BR>Development Objective: Contribute to poverty alleviation, sustainable livelihoods, equity and human wellbeing through development towards resilient ecosystems and societies, especially taking into account the need for adaptation and mitigation to ecosystems change such as climate change.<BR>Programme Objective: Through SwedBio?s strategies promote sustainable ecosystem management, in a land- seascape perspective, and development of good governance, to contribute to the development objective.<BR>To reach the objectives SwedBio will work with the following Strategies:<BR>Strategy 1. International policy and methods development: SwedBio will contribute to networking; dialogue seminars and round table discussions for different stakeholders such as indigenous and local communities, NGOs, and negotiators for conventions; selected methods manuals, including dissemination plans, in relevant fields; advice to Swedish Government Offices.<BR>Strategy 2. Collaborative Programme: SwedBio will contribute to strategically important initiatives in line with SwedBio?s objectives and facilitate access and participation of developing country stakeholders in international policy development concerning SwedBio?s objectives.<BR>Strategy 3. Communication and training: SwedBio will disseminate knowledge, from the think-tank function; produce fact sheets and policy briefs and other easy to access information material; provide knowledge to actors in Swedish development cooperation; provide seminars and courses; perform case studies for integration of BRE in development cooperation; continuously develop a webpage for SwedBio with the help of Albaeco and disseminate information in collaboration with the news-blog SDU (Sustainable Development Update).<BR>Potential Strategy 4. Higher education and research: SwedBio already acts as a knowledge interface bridging between knowledge systems, and the ?higher education and research programme? would strengthen that even further, and foster a closer link between science and policy.",,"002--|019--|142--|","200200","201300","Maria Schultz<BR>E-mail: maria.schultz@stockholmresilience.su.se<BR>Phone: +46 (0) 18 67 27 46","http://www.swedbio.org",".  swedish international biodiversity programme swedbio the swedish international biodiversity programme swedbio was initiated in 2002 by the swedish international development cooperation agency sida and has until 2010 been a programme at swedish biodiversity centre cbm but will from 2011 be a programme at stockholm resilience centre src with a sub agreement with cbm since the start of the programme the evidence of the crucial role of biodiversity and ecosystem services for the poor and their livelihoods has been even more articulated in the light of climate change and the options for win win solutions for adaptation and mitigation to climate change sustainable management of biodiversity and ecosystem services and strengthening of poor people?s livelihood the links between human rights and the sustainable use of natural resources are a cornerstone in swedbio?s work for the phase 2011 2013 swedbio will be an independent think tank programme in the area of biodiversity resilience and ecosystem services and international development cooperation that will increase its emphasis on the knowledge interface role swedbio will have the following objectives for the programme phase 2011 2013 development objective contribute to poverty alleviation sustainable livelihoods equity and human wellbeing through development towards resilient ecosystems and societies especially taking into account the need for adaptation and mitigation to ecosystems change such as climate change programme objective through swedbio?s strategies promote sustainable ecosystem management in a land seascape perspective and development of good governance to contribute to the development objective to reach the objectives swedbio will work with the following strategies strategy 1 international policy and methods development swedbio will contribute to networking; dialogue seminars and round table discussions for different stakeholders such as indigenous and local communities ngos and negotiators for conventions; selected methods manuals including dissemination plans in relevant fields; advice to swedish government offices strategy 2 collaborative programme swedbio will contribute to strategically important initiatives in line with swedbio?s objectives and facilitate access and participation of developing country stakeholders in international policy development concerning swedbio?s objectives strategy 3 communication and training swedbio will disseminate knowledge from the think tank function; produce fact sheets and policy briefs and other easy to access information material; provide knowledge to actors in swedish development cooperation; provide seminars and courses; perform case studies for integration of bre in development cooperation; continuously develop a webpage for swedbio with the help of albaeco and disseminate information in collaboration with the news blog sdu sustainable development update potential strategy 4 higher education and research swedbio already acts as a knowledge interface bridging between knowledge systems and the ?higher education and research programme? would strengthen that even further and foster a closer link between science and policy maria schultz e mail maria schultz stockholmresilience su se phone 46 0 18 67 27 46  .",,,"D0268|D0198|D0122","Swedish International Biodiversity Programme, SwedBio|Biodiversity and Ecosystem Services: Crucial Resources for Poverty Alleviation|Addressing climate-conservation-poverty links in development assistance"
